/*
@author : Sajan

*/
//Welcome to Address Book System DataBase
-------------------------------------------------------
//Use Case 1 Create a Database
mysql> create database AddressBook_Service;
Query OK, 1 row affected (0.56 sec)

mysql> show databases;
+---------------------+
| Database            |
+---------------------+
| addressbook_service |
| information_schema  |
| mysql               |
| payroll_service     |
| performance_schema  |
| sakila              |
| sys                 |
| world               |
+---------------------+
8 rows in set (0.00 sec)
-------------------------------------------------------
//Use Case 2 Create a Table
mysql> use addressbook_service
Database changed
mysql> CREATE TABLE `addressbook_service`.`addressbook`
(  `Sr.no.` INT NOT NULL,  `firstName` VARCHAR(45) NOT NULL,
 `lastName` VARCHAR(45) NOT NULL,
    `City` VARCHAR(45) NOT NULL,
     `State` VARCHAR(45) NOT NULL,
      `ZipCode` INT NOT NULL,
       `PhoneNumber` VARCHAR(45) NOT NULL,
        `email` VARCHAR(255) NOT NULL,
         PRIMARY KEY (`Sr.no.`));
Query OK, 0 rows affected (0.95 sec)
-------------------------------------------------------
//Use Case 3 Insert data in a Table
mysql> INSERT INTO `addressbook_service`.`addressbook` (`Sr.no.`, `firstName`, `lastName`, `address`,
`City`, `State`, `ZipCode`, `PhoneNumber`, `email`)
VALUES ('1', 'Sajan', 'Mhatre', 'Uran', 'Vashi', 'Maharashtra', '400702', '9988776622', 'sajan@gmail.com');
Query OK, 1 row affected (0.09 sec)
-------------------------------------------------------
//Use Case 4 Edit data in a Table
mysql> UPDATE `addressbook_service`.`addressbook`
SET `firstName` = 'Sagar',
`address` = 'Dadar',
`State` = 'Telengana',
`ZipCode` = '400897',
`PhoneNumber` = '9923412366',
`email` = 'sagar88@gmail.com'
 WHERE (`firstName` = 'Sajan');
Query OK, 1 row affected (0.10 sec)
Rows matched: 1  Changed: 1  Warnings: 0
-------------------------------------------------------
//Use Case 5 Delete Contact
mysql> DELETE FROM `addressbook_service`.`addressbook`
WHERE (`firstName` = 'Rahul');
Query OK, 1 row affected (0.15 sec)
-------------------------------------------------------
//Use Case 6 Retrieve Contact
mysql> SELECT * FROM addressbook_service.addressbook;
+--------+-----------+----------+---------+---------+-----------+---------+-------------+---------------------+
| Sr.no. | firstName | lastName | address | City    | State     | ZipCode | PhoneNumber | email               |
+--------+-----------+----------+---------+---------+-----------+---------+-------------+---------------------+
|      1 | Sagar     | Mhatre   | Dadar   | Vashi   | Telengana |  400897 | 9923412366  | sagar88@gmail.com   |
|      3 | Vaibhav   | Thakur   | Dilor   | Matunga | Kerela    |  781002 | 9912341243  | vaibhav12@gmail.com |
|      4 | Sajan     | Mhatre   | Thane   | Nagoan  | UP        |  890123 | 8978098909  | sajan19@gmail.com   |
|      5 | Devedra   | Shravne  | Sion    | Karnir  | Karnataka |  980400 | 7968453211  | devd23@gmail.com    |
+--------+-----------+----------+---------+---------+-----------+---------+-------------+---------------------+
4 rows in set (0.03 sec)
//Getting Contact Records using City Name
mysql> SELECT * FROM addressbook_service.addressbook WHERE (City = 'Vashi');
+--------+-----------+----------+---------+-------+-----------+---------+-------------+-------------------+
| Sr.no. | firstName | lastName | address | City  | State     | ZipCode | PhoneNumber | email             |
+--------+-----------+----------+---------+-------+-----------+---------+-------------+-------------------+
|      1 | Sagar     | Mhatre   | Dadar   | Vashi | Telengana |  400897 | 9923412366  | sagar88@gmail.com |
|      6 | Raj       | Tandel   | Juhu    | Vashi | Telengana |  400892 | 8978121314  | raj23@gmail.com   |
+--------+-----------+----------+---------+-------+-----------+---------+-------------+-------------------+
2 rows in set (0.01 sec)
//Getting Contact Records using State Name
mysql> SELECT * FROM addressbook_service.addressbook WHERE (State = 'Kerela');
+--------+-----------+----------+---------+---------+--------+---------+-------------+---------------------+
| Sr.no. | firstName | lastName | address | City    | State  | ZipCode | PhoneNumber | email               |
+--------+-----------+----------+---------+---------+--------+---------+-------------+---------------------+
|      3 | Vaibhav   | Thakur   | Dilor   | Matunga | Kerela |  781002 | 9912341243  | vaibhav12@gmail.com |
|      7 | Rohit     | Patel    | Sonari  | Bhandup | Kerela |  789081 | 8978123451  | rohit1@gmail.com    |
+--------+-----------+----------+---------+---------+--------+---------+-------------+---------------------+
2 rows in set (0.02 sec)