/*
@author : Sajan

*/
//Welcome to Address Book System DataBase
-------------------------------------------------------
//Use Case 1 Create a Database
mysql> create database AddressBook_Service;
Query OK, 1 row affected (0.56 sec)

mysql> show databases;
+---------------------+
| Database            |
+---------------------+
| addressbook_service |
| information_schema  |
| mysql               |
| payroll_service     |
| performance_schema  |
| sakila              |
| sys                 |
| world               |
+---------------------+
8 rows in set (0.00 sec)
-------------------------------------------------------
//Use Case 2 Create a Table
mysql> use addressbook_service
Database changed
mysql> CREATE TABLE `addressbook_service`.`addressbook`
(  `Sr.no.` INT NOT NULL,  `firstName` VARCHAR(45) NOT NULL,
 `lastName` VARCHAR(45) NOT NULL,
    `City` VARCHAR(45) NOT NULL,
     `State` VARCHAR(45) NOT NULL,
      `ZipCode` INT NOT NULL,
       `PhoneNumber` VARCHAR(45) NOT NULL,
        `email` VARCHAR(255) NOT NULL,
         PRIMARY KEY (`Sr.no.`));
Query OK, 0 rows affected (0.95 sec)
-------------------------------------------------------
//Use Case 3 Insert data in a Table
mysql> INSERT INTO `addressbook_service`.`addressbook` (`Sr.no.`, `firstName`, `lastName`, `address`,
`City`, `State`, `ZipCode`, `PhoneNumber`, `email`)
VALUES ('1', 'Sajan', 'Mhatre', 'Uran', 'Vashi', 'Maharashtra', '400702', '9988776622', 'sajan@gmail.com');
Query OK, 1 row affected (0.09 sec)
-------------------------------------------------------
//Use Case 4 Edit data in a Table
mysql> UPDATE `addressbook_service`.`addressbook`
SET `firstName` = 'Sagar',
`address` = 'Dadar',
`State` = 'Telengana',
`ZipCode` = '400897',
`PhoneNumber` = '9923412366',
`email` = 'sagar88@gmail.com'
 WHERE (`firstName` = 'Sajan');
Query OK, 1 row affected (0.10 sec)
Rows matched: 1  Changed: 1  Warnings: 0
-------------------------------------------------------
//Use Case 5 Delete Contact
mysql> DELETE FROM `addressbook_service`.`addressbook`
WHERE (`firstName` = 'Rahul');
Query OK, 1 row affected (0.15 sec)
-------------------------------------------------------
//Use Case 6 Retrieve Contact
mysql> SELECT * FROM addressbook_service.addressbook;
+--------+-----------+----------+---------+---------+-----------+---------+-------------+---------------------+
| Sr.no. | firstName | lastName | address | City    | State     | ZipCode | PhoneNumber | email               |
+--------+-----------+----------+---------+---------+-----------+---------+-------------+---------------------+
|      1 | Sagar     | Mhatre   | Dadar   | Vashi   | Telengana |  400897 | 9923412366  | sagar88@gmail.com   |
|      3 | Vaibhav   | Thakur   | Dilor   | Matunga | Kerela    |  781002 | 9912341243  | vaibhav12@gmail.com |
|      4 | Sajan     | Mhatre   | Thane   | Nagoan  | UP        |  890123 | 8978098909  | sajan19@gmail.com   |
|      5 | Devedra   | Shravne  | Sion    | Karnir  | Karnataka |  980400 | 7968453211  | devd23@gmail.com    |
+--------+-----------+----------+---------+---------+-----------+---------+-------------+---------------------+
4 rows in set (0.03 sec)
//Getting Contact Records using City Name
mysql> SELECT * FROM addressbook_service.addressbook WHERE (City = 'Vashi');
+--------+-----------+----------+---------+-------+-----------+---------+-------------+-------------------+
| Sr.no. | firstName | lastName | address | City  | State     | ZipCode | PhoneNumber | email             |
+--------+-----------+----------+---------+-------+-----------+---------+-------------+-------------------+
|      1 | Sagar     | Mhatre   | Dadar   | Vashi | Telengana |  400897 | 9923412366  | sagar88@gmail.com |
|      6 | Raj       | Tandel   | Juhu    | Vashi | Telengana |  400892 | 8978121314  | raj23@gmail.com   |
+--------+-----------+----------+---------+-------+-----------+---------+-------------+-------------------+
2 rows in set (0.01 sec)
//Getting Contact Records using State Name
mysql> SELECT * FROM addressbook_service.addressbook WHERE (State = 'Kerela');
+--------+-----------+----------+---------+---------+--------+---------+-------------+---------------------+
| Sr.no. | firstName | lastName | address | City    | State  | ZipCode | PhoneNumber | email               |
+--------+-----------+----------+---------+---------+--------+---------+-------------+---------------------+
|      3 | Vaibhav   | Thakur   | Dilor   | Matunga | Kerela |  781002 | 9912341243  | vaibhav12@gmail.com |
|      7 | Rohit     | Patel    | Sonari  | Bhandup | Kerela |  789081 | 8978123451  | rohit1@gmail.com    |
+--------+-----------+----------+---------+---------+--------+---------+-------------+---------------------+
2 rows in set (0.02 sec)
-------------------------------------------------------
//Use Case 7 Size of Address Book using City and State
mysql> SELECT COUNT(City) FROM addressbook_service.addressbook;
+-------------+
| COUNT(City) |
+-------------+
|           7 |
+-------------+
1 row in set (0.00 sec)

mysql> SELECT COUNT(State) FROM addressbook_service.addressbook;
+--------------+
| COUNT(State) |
+--------------+
|            7 |
+--------------+
1 row in set (0.00 sec)
-------------------------------------------------------
//Use Case 8 Sort Entries alphabetically
mysql> SELECT * FROM addressbook_service.addressbook ORDER BY firstName;
+--------+-----------+----------+---------+---------+-----------+---------+-------------+----------------------+
| Sr.no. | firstName | lastName | address | City    | State     | ZipCode | PhoneNumber | email                |
+--------+-----------+----------+---------+---------+-----------+---------+-------------+----------------------+
|      5 | Devedra   | Shravne  | Sion    | Karnir  | Karnataka |  980400 | 7968453211  | devd23@gmail.com     |
|      8 | Himanshu  | Mali     | Belpada | Thane   | UP        |  400789 | 8977661234  | himanshu33@gmail.com |
|      6 | Raj       | Tandel   | Juhu    | Vashi   | Telengana |  400892 | 8978121314  | raj23@gmail.com      |
|      7 | Rohit     | Patel    | Sonari  | Bhandup | Kerela    |  789081 | 8978123451  | rohit1@gmail.com     |
|      1 | Sagar     | Mhatre   | Dadar   | Vashi   | Telengana |  400897 | 9923412366  | sagar88@gmail.com    |
|      4 | Sajan     | Mhatre   | Thane   | Nagoan  | UP        |  890123 | 8978098909  | sajan19@gmail.com    |
|      3 | Vaibhav   | Thakur   | Dilor   | Matunga | Kerela    |  781002 | 9912341243  | vaibhav12@gmail.com  |
+--------+-----------+----------+---------+---------+-----------+---------+-------------+----------------------+
7 rows in set (0.00 sec)
-------------------------------------------------------
//Use Case 9 Add Column type in the table
mysql> Alter table addressbook_service.addressbook add type varchar(20) after lastName ;
mysql> SELECT * FROM addressbook;
+--------+-----------+----------+------+---------+---------+-----------+---------+-------------+----------------------+
| Sr.no. | firstName | lastName | type | address | City    | State     | ZipCode | PhoneNumber | email                |
+--------+-----------+----------+------+---------+---------+-----------+---------+-------------+----------------------+
|      1 | Sagar     | Mhatre   | NULL | Dadar   | Vashi   | Telengana |  400897 | 9923412366  | sagar88@gmail.com    |
|      3 | Vaibhav   | Thakur   | NULL | Dilor   | Matunga | Kerela    |  781002 | 9912341243  | vaibhav12@gmail.com  |
|      4 | Sajan     | Mhatre   | NULL | Thane   | Nagoan  | UP        |  890123 | 8978098909  | sajan19@gmail.com    |
|      5 | Devedra   | Shravne  | NULL | Sion    | Karnir  | Karnataka |  980400 | 7968453211  | devd23@gmail.com     |
|      6 | Raj       | Tandel   | NULL | Juhu    | Vashi   | Telengana |  400892 | 8978121314  | raj23@gmail.com      |
|      7 | Rohit     | Patel    | NULL | Sonari  | Bhandup | Kerela    |  789081 | 8978123451  | rohit1@gmail.com     |
|      8 | Himanshu  | Mali     | NULL | Belpada | Thane   | UP        |  400789 | 8977661234  | himanshu33@gmail.com |
+--------+-----------+----------+------+---------+---------+-----------+---------+-------------+----------------------+
7 rows in set (0.00 sec)

mysql> UPDATE `addressbook_service`.`addressbook` SET `type` = 'family' WHERE (`firstName` = 'Sajan');
Query OK, 1 row affected (0.09 sec)
Rows matched: 1  Changed: 1  Warnings: 0

mysql> UPDATE `addressbook_service`.`addressbook` SET `type` = 'friend' WHERE (`firstName` = 'Vaibhav');
Query OK, 1 row affected (0.21 sec)
Rows matched: 1  Changed: 1  Warnings: 0

mysql> UPDATE `addressbook_service`.`addressbook` SET `type` = 'friend' WHERE (`firstName` = 'Devedra');
Query OK, 1 row affected (0.23 sec)
Rows matched: 1  Changed: 1  Warnings: 0

mysql> UPDATE `addressbook_service`.`addressbook` SET `type` = 'friend' WHERE (`firstName` = 'Raj');
Query OK, 1 row affected (0.16 sec)
Rows matched: 1  Changed: 1  Warnings: 0

mysql> UPDATE `addressbook_service`.`addressbook` SET `type` = 'friend' WHERE (`firstName` = 'Himanshu');
Query OK, 1 row affected (0.13 sec)
Rows matched: 1  Changed: 1  Warnings: 0

mysql> SELECT * FROM addressbook;
+--------+-----------+----------+--------+---------+---------+-----------+---------+-------------+----------------------+
| Sr.no. | firstName | lastName | type   | address | City    | State     | ZipCode | PhoneNumber | email                |
+--------+-----------+----------+--------+---------+---------+-----------+---------+-------------+----------------------+
|      1 | Sagar     | Mhatre   | family | Dadar   | Vashi   | Telengana |  400897 | 9923412366  | sagar88@gmail.com    |
|      3 | Vaibhav   | Thakur   | friend | Dilor   | Matunga | Kerela    |  781002 | 9912341243  | vaibhav12@gmail.com  |
|      4 | Sajan     | Mhatre   | family | Thane   | Nagoan  | UP        |  890123 | 8978098909  | sajan19@gmail.com    |
|      5 | Devedra   | Shravne  | friend | Sion    | Karnir  | Karnataka |  980400 | 7968453211  | devd23@gmail.com     |
|      6 | Raj       | Tandel   | friend | Juhu    | Vashi   | Telengana |  400892 | 8978121314  | raj23@gmail.com      |
|      7 | Rohit     | Patel    | family | Sonari  | Bhandup | Kerela    |  789081 | 8978123451  | rohit1@gmail.com     |
|      8 | Himanshu  | Mali     | friend | Belpada | Thane   | UP        |  400789 | 8977661234  | himanshu33@gmail.com |
+--------+-----------+----------+--------+---------+---------+-----------+---------+-------------+----------------------+
7 rows in set (0.00 sec)

-------------------------------------------------------
//Use Case 10 Count by each type

mysql> select type, count(type) from  `addressbook_service`.`addressbook` group by type;
+--------+-------------+
| type   | count(type) |
+--------+-------------+
| family |           3 |
| friend |           4 |
+--------+-------------+
2 rows in set (0.07 sec)

-------------------------------------------------------
//Use Case 11 Ability to add person to both Friend and Family
mysql> INSERT INTO `addressbook_service`.`addressbook` (`Sr.no.`, `firstName`, `lastName`, `type`, `address`,
 `City`, `State`, `ZipCode`, `PhoneNumber`, `email`)
VALUES ('9', 'Rani', 'Patil', 'friend', 'Sarde',
'Panvel', 'MP', '600712', '8855119900', 'ranip22@gmail.com');
INSERT INTO `addressbook_service`.`addressbook` (`Sr.no.`, `firstName`, `lastName`, `type`, `address`,
`City`, `State`, `ZipCode`, `PhoneNumber`, `email`)
VALUES ('10', 'Rajesh', 'Kumar', 'family', 'Funda', 'Airoli',
 'Telengana', '542009', '7812901266', 'rajesh7@gmail.com');
Query OK, 1 row affected (0.16 sec)

Query OK, 1 row affected (0.06 sec)

mysql> select * from addressbook;
+--------+-----------+----------+--------+---------+---------+-----------+---------+-------------+----------------------+
| Sr.no. | firstName | lastName | type   | address | City    | State     | ZipCode | PhoneNumber | email                |
+--------+-----------+----------+--------+---------+---------+-----------+---------+-------------+----------------------+
|      1 | Sagar     | Mhatre   | family | Dadar   | Vashi   | Telengana |  400897 | 9923412366  | sagar88@gmail.com    |
|      3 | Vaibhav   | Thakur   | friend | Dilor   | Matunga | Kerela    |  781002 | 9912341243  | vaibhav12@gmail.com  |
|      4 | Sajan     | Mhatre   | family | Thane   | Nagoan  | UP        |  890123 | 8978098909  | sajan19@gmail.com    |
|      5 | Devedra   | Shravne  | friend | Sion    | Karnir  | Karnataka |  980400 | 7968453211  | devd23@gmail.com     |
|      6 | Raj       | Tandel   | friend | Juhu    | Vashi   | Telengana |  400892 | 8978121314  | raj23@gmail.com      |
|      7 | Rohit     | Patel    | family | Sonari  | Bhandup | Kerela    |  789081 | 8978123451  | rohit1@gmail.com     |
|      8 | Himanshu  | Mali     | friend | Belpada | Thane   | UP        |  400789 | 8977661234  | himanshu33@gmail.com |
|      9 | Rani      | Patil    | friend | Sarde   | Panvel  | MP        |  600712 | 8855119900  | ranip22@gmail.com    |
|     10 | Rajesh    | Kumar    | family | Funda   | Airoli  | Telengana |  542009 | 7812901266  | rajesh7@gmail.com    |
+--------+-----------+----------+--------+---------+---------+-----------+---------+-------------+----------------------+
9 rows in set (0.03 sec)

-------------------------------------------------------
//Use Case 12 Creating new table and specifying foreign key

mysql> CREATE TABLE `addressbook_service`.`relation_type` (  `type_id` INT NOT NULL,  `type` VARCHAR(45) NOT NULL,
 PRIMARY KEY (`type`));
Query OK, 0 rows affected (1.32 sec)

mysql> INSERT INTO `addressbook_service`.`relation_type` (`type_id`, `type`) VALUES ('1', 'family');
INSERT INTO `addressbook_service`.`relation_type` (`type_id`, `type`) VALUES ('2', 'friends');
Query OK, 1 row affected (0.19 sec)

Query OK, 1 row affected (0.12 sec)

mysql> Select * from `addressbook_service`.`relation_type`;
+---------+---------+
| type_id | type    |
+---------+---------+
|       1 | family  |
|       2 | friends |
+---------+---------+
2 rows in set (0.00 sec)

mysql> ALTER TABLE `addressbook_service`.`relation_type` ADD INDEX `type_idx` (`type` ASC) VISIBLE;;
 ALTER TABLE `addressbook_service`.`relation_type` ADD CONSTRAINT `type`
 FOREIGN KEY (`type`)  REFERENCES `addressbook_service`.`addressbook` (`type`)
 ON DELETE NO ACTION  ON UPDATE NO ACTION;
Query OK, 0 rows affected (0.77 sec)
Records: 0  Duplicates: 0  Warnings: 0
Query OK, 2 rows affected (2.18 sec)
Records: 2  Duplicates: 0  Warnings: 0

mysql> select * from addressbook inner join relation_type on addressbook.type = relation_type.type\G;
*************************** 1. row ***************************
     Sr.no.: 1
  firstName: Sagar
   lastName: Mhatre
       type: family
    address: Dadar
       City: Vashi
      State: Telengana
    ZipCode: 400897
PhoneNumber: 9923412366
      email: sagar88@gmail.com
    type_id: 1
       type: family
*************************** 2. row ***************************
     Sr.no.: 3
  firstName: Vaibhav
   lastName: Thakur
       type: friend
    address: Dilor
       City: Matunga
      State: Kerela
    ZipCode: 781002
PhoneNumber: 9912341243
      email: vaibhav12@gmail.com
    type_id: 2
       type: friend
*************************** 3. row ***************************
     Sr.no.: 4
  firstName: Sajan
   lastName: Mhatre
       type: family
    address: Thane
       City: Nagoan
      State: UP
    ZipCode: 890123
PhoneNumber: 8978098909
      email: sajan19@gmail.com
    type_id: 1
       type: family
*************************** 4. row ***************************
     Sr.no.: 5
  firstName: Devedra
   lastName: Shravne
       type: friend
    address: Sion
       City: Karnir
      State: Karnataka
    ZipCode: 980400
PhoneNumber: 7968453211
      email: devd23@gmail.com
    type_id: 2
       type: friend
*************************** 5. row ***************************
     Sr.no.: 6
  firstName: Raj
   lastName: Tandel
       type: friend
    address: Juhu
       City: Vashi
      State: Telengana
    ZipCode: 400892
PhoneNumber: 8978121314
      email: raj23@gmail.com
    type_id: 2
       type: friend
*************************** 6. row ***************************
     Sr.no.: 7
  firstName: Rohit
   lastName: Patel
       type: family
    address: Sonari
       City: Bhandup
      State: Kerela
    ZipCode: 789081
PhoneNumber: 8978123451
      email: rohit1@gmail.com
    type_id: 1
       type: family
*************************** 7. row ***************************
     Sr.no.: 8
  firstName: Himanshu
   lastName: Mali
       type: friend
    address: Belpada
       City: Thane
      State: UP
    ZipCode: 400789
PhoneNumber: 8977661234
      email: himanshu33@gmail.com
    type_id: 2
       type: friend
*************************** 8. row ***************************
     Sr.no.: 9
  firstName: Rani
   lastName: Patil
       type: friend
    address: Sarde
       City: Panvel
      State: MP
    ZipCode: 600712
PhoneNumber: 8855119900
      email: ranip22@gmail.com
    type_id: 2
       type: friend
*************************** 9. row ***************************
     Sr.no.: 10
  firstName: Rajesh
   lastName: Kumar
       type: family
    address: Funda
       City: Airoli
      State: Telengana
    ZipCode: 542009
PhoneNumber: 7812901266
      email: rajesh7@gmail.com
    type_id: 1
       type: family
9 rows in set (0.06 sec)

ERROR:
No query specified

mysql>

-------------------------------------------------------
//Use Case 13 Retrieving Data from New Table Structure

mysql> select * from addressbook inner join relation_type on addressbook.type = relation_type.type WHERE (City = 'Vashi');
+--------+-----------+----------+--------+---------+-------+-----------+---------+-------------+-------------------+---------+--------+
| Sr.no. | firstName | lastName | type   | address | City  | State     | ZipCode | PhoneNumber | email             | type_id | type   |
+--------+-----------+----------+--------+---------+-------+-----------+---------+-------------+-------------------+---------+--------+
|      1 | Sagar     | Mhatre   | family | Dadar   | Vashi | Telengana |  400897 | 9923412366  | sagar88@gmail.com |       1 | family |
|      6 | Raj       | Tandel   | friend | Juhu    | Vashi | Telengana |  400892 | 8978121314  | raj23@gmail.com   |       2 | friend |
+--------+-----------+----------+--------+---------+-------+-----------+---------+-------------+-------------------+---------+--------+
2 rows in set (0.00 sec)

mysql> select * from addressbook inner join relation_type on addressbook.type = relation_type.type WHERE (State = 'Kerela');
+--------+-----------+----------+--------+---------+---------+--------+---------+-------------+---------------------+---------+--------+
| Sr.no. | firstName | lastName | type   | address | City    | State  | ZipCode | PhoneNumber | email               | type_id | type   |
+--------+-----------+----------+--------+---------+---------+--------+---------+-------------+---------------------+---------+--------+
|      3 | Vaibhav   | Thakur   | friend | Dilor   | Matunga | Kerela |  781002 | 9912341243  | vaibhav12@gmail.com |       2 | friend |
|      7 | Rohit     | Patel    | family | Sonari  | Bhandup | Kerela |  789081 | 8978123451  | rohit1@gmail.com    |       1 | family |
+--------+-----------+----------+--------+---------+---------+--------+---------+-------------+---------------------+---------+--------+
2 rows in set (0.00 sec)

mysql> SELECT COUNT(City) FROM addressbook inner join relation_type on addressbook.type = relation_type.type;
+-------------+
| COUNT(City) |
+-------------+
|           9 |
+-------------+
1 row in set (0.05 sec)

mysql> SELECT COUNT(State) FROM addressbook inner join relation_type on addressbook.type = relation_type.type;
+--------------+
| COUNT(State) |
+--------------+
|            9 |
+--------------+
1 row in set (0.00 sec)

mysql> select * from addressbook inner join relation_type on addressbook.type = relation_type.type ORDER by firstName;
+--------+-----------+----------+--------+---------+---------+-----------+---------+-------------+----------------------+---------+--------+
| Sr.no. | firstName | lastName | type   | address | City    | State     | ZipCode | PhoneNumber | email                | type_id | type   |
+--------+-----------+----------+--------+---------+---------+-----------+---------+-------------+----------------------+---------+--------+
|      5 | Devedra   | Shravne  | friend | Sion    | Karnir  | Karnataka |  980400 | 7968453211  | devd23@gmail.com     |       2 | friend |
|      8 | Himanshu  | Mali     | friend | Belpada | Thane   | UP        |  400789 | 8977661234  | himanshu33@gmail.com |       2 | friend |
|      6 | Raj       | Tandel   | friend | Juhu    | Vashi   | Telengana |  400892 | 8978121314  | raj23@gmail.com      |       2 | friend |
|     10 | Rajesh    | Kumar    | family | Funda   | Airoli  | Telengana |  542009 | 7812901266  | rajesh7@gmail.com    |       1 | family |
|      9 | Rani      | Patil    | friend | Sarde   | Panvel  | MP        |  600712 | 8855119900  | ranip22@gmail.com    |       2 | friend |
|      7 | Rohit     | Patel    | family | Sonari  | Bhandup | Kerela    |  789081 | 8978123451  | rohit1@gmail.com     |       1 | family |
|      1 | Sagar     | Mhatre   | family | Dadar   | Vashi   | Telengana |  400897 | 9923412366  | sagar88@gmail.com    |       1 | family |
|      4 | Sajan     | Mhatre   | family | Thane   | Nagoan  | UP        |  890123 | 8978098909  | sajan19@gmail.com    |       1 | family |
|      3 | Vaibhav   | Thakur   | friend | Dilor   | Matunga | Kerela    |  781002 | 9912341243  | vaibhav12@gmail.com  |       2 | friend |
+--------+-----------+----------+--------+---------+---------+-----------+---------+-------------+----------------------+---------+--------+
9 rows in set (0.00 sec)

mysql> select type_id, count(type_id) from addressbook inner join relation_type on addressbook.type = relation_type.type group by type_id;
+---------+----------------+
| type_id | count(type_id) |
+---------+----------------+
|       1 |              4 |
|       2 |              5 |
+---------+----------------+
2 rows in set (0.02 sec)

